{
  "title": "Published Testorganization",
  "_uuid": "214ca5bf-da1b-4003-b7b6-e73a2ef0ec10",
  "_type": "McloudAddressDoc",
  "address": {
    "city": "Frankfurt",
    "po-box": "ABCDEF",
    "street": "Musterstr. 12",
    "zip-code": "12345",
    "zip-po-box": "98765"
  },
  "contact": [
    {
      "type": {
        "key": "1"
      },
      "connection": "03351464321653"
    },
    {
      "type": {
        "key": "3"
      },
      "connection": "abc@def.gh"
    }
  ],
  "organization": "Published Testorganization"
}