{
  "title": "Published Testorganization",
  "_uuid": "214ca5bf-da1b-4003-b7b6-e73a2ef0ec10",
  "_type": "McloudAddressDoc",
  "address": {
    "city": null,
    "po-box": null,
    "street": null,
    "zip-code": null,
    "zip-po-box": null
  },
  "contact": [
    {
      "type": {
        "key": "1"
      },
      "connection": "03351464321653"
    }
  ],
  "organization": "Published Testorganization"
}
           